{
  "schema": "ph-as07-continuity-feed-forward.v1",
  "schemaVersion": "1",
  "task": "TASK-AS07",
  "recordedAt": "2026-09-10",
  "sourceEvidence": {
    "as06ProvenancePath": "authoring/outputs/as06-same-subject-continuity-provenance-20260910.json",
    "as06Disposition": "complete-unresolved-with-stronger-same-subject-evidence",
    "radialArteryIdentity": "unresolved",
    "superficialVeinIdentity": "unresolved"
  },
  "updates": {
    "a06": {
      "path": "authoring/manual-inputs/a06-manual-correction-status-20260910.json",
      "radialArteryStatus": "blocked-source-evidence",
      "ulnarArteryStatus": "reviewed-no-change",
      "superficialTargetVeinStatus": "blocked-source-evidence",
      "newHumanReviewPerformed": false
    },
    "a07": {
      "path": "authoring/semantic/a07-semantic-structure-mapping-20260910.json",
      "radialArteryMappingStatus": "semantic-id-reserved-no-representation",
      "radialRepresentationAvailable": false,
      "superficialTargetAnatomicalId": null,
      "procedureRoleUsedAsIdentity": false
    },
    "a08": {
      "path": "authoring/outputs/a08-vessel-centerline-authoring-report-20260910.json",
      "radialArteryCenterlineStatus": "blocked",
      "ulnarArteryCenterlineStatus": "generated",
      "superficialTargetCenterlineStatus": "blocked"
    },
    "a09": {
      "path": "authoring/outputs/a09-boundary-lumen-authoring-report-20260910.json",
      "radialArteryRepresentationStatus": "blocked",
      "ulnarArteryRepresentationStatus": "generated",
      "superficialTargetRepresentationStatus": "blocked"
    },
    "a10": {
      "path": "authoring/outputs/a10-medical-master-readiness-20260910.json",
      "status": "blocked",
      "automaticPromotionAllowed": false
    }
  },
  "gateS": {
    "status": "complete",
    "reusableWholeBodySourceFoundationConfirmed": true,
    "missingMvpVascularIdentitiesReevaluatedFromSameSubjectEvidence": true,
    "wholeBodyMedicalMasterImplied": false
  },
  "claims": {
    "newHumanReviewPerformed": false,
    "radialArteryIdentityEstablished": false,
    "namedSuperficialVeinIdentityEstablished": false,
    "crossSubjectAtlasGeometryPromoted": false,
    "procedureRoleUsedAsAnatomicalIdentity": false,
    "patientSpaceGeometry": false,
    "medicalValidation": false,
    "medicalMasterCreated": false,
    "automaticPromotionAllowed": false
  }
}
